[
  {
    "schema_version": "1.0",
    "data_mode": "fixture",
    "event_id": "evt_mixer_001",
    "title": "SF AI Founders Mega Mixer",
    "description": "A large evening mixer for AI founders, investors, and builders.",
    "source_url": "https://example.com/events/ai-founders-mixer",
    "source_name": "Event Copilot demo fixture",
    "start_time": "2026-07-25T18:00:00-07:00",
    "location": "San Francisco",
    "themes": [
      "AI agents",
      "founders"
    ],
    "format": "mixer",
    "interaction_level": 0.98,
    "knowledge_depth": 0.56,
    "estimated_crowd_size": 450,
    "cost_usd": 25
  },
  {
    "schema_version": "1.0",
    "data_mode": "fixture",
    "event_id": "evt_workshop_001",
    "title": "Building Self-Improving Agents Workshop",
    "description": "A small hands-on workshop for designing agent memory and feedback loops.",
    "source_url": "https://example.com/events/agent-workshop",
    "source_name": "Event Copilot demo fixture",
    "start_time": "2026-07-26T10:00:00-07:00",
    "location": "San Francisco",
    "themes": [
      "AI agents",
      "CTO leadership"
    ],
    "format": "workshop",
    "interaction_level": 0.82,
    "knowledge_depth": 0.96,
    "estimated_crowd_size": 42,
    "cost_usd": 40
  },
  {
    "schema_version": "1.0",
    "data_mode": "live",
    "event_id": "evt_live_swarmhack_20260724",
    "title": "Self-Evolving Agents Hackathon",
    "description": "A full day of building alongside engineers, founders, and operators with APIs, infrastructure, mentors, and community.",
    "source_url": "https://luma.com/swarmhack",
    "source_name": "Luma",
    "start_time": "2026-07-24T09:30:00-07:00",
    "location": "San Francisco",
    "themes": [
      "AI agents",
      "founders"
    ],
    "format": "hackathon",
    "interaction_level": 0.75,
    "knowledge_depth": 0.85,
    "estimated_crowd_size": null,
    "cost_usd": 0
  }
]
